sigla,significado_EN,traducao_PT_sugerida,categoria_sugerida,cabe_na_taxonomia,confianca,nota,bucket_sugerido
PAP,Program Assurance Process or Planning,Processo/Planejamento de Garantia do Programa,,nao,alta,,processos-qualidade
PASD,Power and Signal Distribution,Distribuição de Energia e Sinal,componentes,sim,media,,
PBD,Price Break Down,Detalhamento de Preço (composição de custo),,nao,alta,,comercial-mercado
PC,Project Chief,Chefe de Projeto,,nao,media,Múltiplos significados (tb. Product Committee).,organizacao-gestao
PCB,Printed Circuit Board,Placa de Circuito Impresso (PCB),componentes,sim,alta,,
PCC,Performance Competence Center,Centro de Competência de Performance,,nao,alta,,organizacao-gestao
PCL,Part Change Level,Nível de Alteração da Peça,,nao,alta,,processos-qualidade
PCR,Process Change Request,Solicitação de Mudança de Processo,,nao,alta,,processos-qualidade
PD,Product Development – New Model Development Department,Desenvolvimento de Produto — departamento de desenvolvimento de novos modelos,,nao,alta,,organizacao-gestao
PDC,Passenger Door Commands,Comandos da Porta do Passageiro,componentes,sim,media,Múltiplos significados (tb. Power Distribution Center).,
PDM,Product Data Management (EBoM Analyst),Gestão de Dados de Produto (analista EBoM),,nao,alta,,ti-sistemas
PDO,Product Design Office,Escritório de Design de Produto,,nao,alta,,organizacao-gestao
PDP,Part Development Plan (database),Plano de Desenvolvimento de Peça (banco de dados),,nao,alta,,processos-qualidade
PDR,Production Demonstration Run,Corrida de Demonstração de Produção (lote piloto),,nao,alta,,processos-qualidade
PDU,Power Distribution Unit,Unidade de Distribuição de Energia (elétrica),componentes,sim,alta,,
PE,Performance Engineer,Engenheiro de Performance,,nao,alta,,organizacao-gestao
PER,Plant Evaluation Run,Corrida de Avaliação de Planta,,nao,media,Múltiplos significados (Production Evaluation Request).,processos-qualidade
PF.nnnnn,Performance Specification for a component or a class of components,Especificação de Performance para um componente ou classe de componentes,,nao,alta,,normas-especificacoes
PFMEA,Process Failure Mode and Effect Analysis,Análise de Modo e Efeitos de Falha de Processo (PFMEA),,nao,alta,,processos-qualidade
PFP,Production Programs and Factors,Programas e Fatores de Produção,,nao,media,,processos-qualidade
PH,Pre-History,"Pré-História (fase inicial do projeto, anterior ao início formal)",,nao,media,,processos-qualidade
Pianale,"estrutura (em chapa) inferior do carro (assoalho, pavimento)",Estrutura (em chapa) inferior do carro (assoalho/plataforma),plataformas,sim,alta,Termo em italiano (Pianale).,
Piano Sviluppo Componenti,Plano Desenvolvimento Componentes,Plano de Desenvolvimento de Componentes,,nao,alta,Termo em italiano.,processos-qualidade
PIM,Cartelinos de verifica virtual,Registros de verificação virtual (Packaging Issue Management),,nao,media,Múltiplos significados.,processos-qualidade
PK (detector),Peak detector according to CISPR 25,Detector de pico (PK) conforme CISPR 25 (EMC),,nao,alta,,processos-qualidade
PKG,Packaging,Packaging (arranjo/integração de conjuntos),,nao,media,,processos-qualidade
Plafon,Painel Superior do Veículo,Painel/forro superior do veículo (teto interno),componentes,sim,alta,,
Plant Quality,Plant Quality,Qualidade da Planta (Plant Quality),,nao,alta,,processos-qualidade
PLGM,Power Liftgate Module,Módulo da Tampa Traseira Elétrica,componentes,sim,alta,,
PM,Program Manager,Gerente de Programa,,nao,alta,,organizacao-gestao
PMO,Process (and/or) Project Management Office,Escritório de Gestão de Processos/Projetos (PMO),,nao,alta,,organizacao-gestao
PMU (Physical Mock Up),verificação física do veículo,Verificação física do veículo (mock-up físico),,nao,alta,,processos-qualidade
PO,Purchase Order (ordem de compra),Ordem de Compra,,nao,media,Múltiplos significados (tb. Process Owner).,comercial-mercado
POU,Pin Out,Pinagem (pin out),tecnologia,sim,alta,,
PPAP,Production Part Approval Process. EQF realiza a alto qualificação do sub fornecedor para verificar se tem condição de fornecer,Processo de Aprovação de Peça de Produção (PPAP); o EQF realiza a qualificação do subfornecedor para verificar se tem condições de fornecer,,nao,alta,,processos-qualidade
PPF,Supplier Test Plan,Plano de Teste do Fornecedor,,nao,media,,processos-qualidade
PPID,Parent Process Identification (número de identificação do processo-pai),Identificação do Processo-Pai (número de identificação),,nao,alta,,processos-qualidade
PPR,Process Planning Review,Revisão de Planejamento de Processo,,nao,media,Múltiplos significados (Plant Process Readiness).,processos-qualidade
PQ,Perceived Quality & Craftsmanship (in PD Dept.),Qualidade Percebida e Acabamento (na área de PD),,nao,alta,,processos-qualidade
PR,Project Responsible,Responsável de Projeto,,nao,alta,,organizacao-gestao
PRA,Production Approval (ex DaP),Aprovação de Produção (ex-DaP),,nao,alta,,processos-qualidade
Pré-Sigi,metodologia de confiabilidade com o objetivo de eliminar defeitos de mortalidade infantil,Metodologia de confiabilidade com o objetivo de eliminar defeitos de mortalidade infantil (falhas prematuras),,nao,alta,,processos-qualidade
Proto.,Prototype,Protótipo,,nao,alta,,glossario-generico
PS,Pré-série,Pré-série,,nao,alta,,processos-qualidade
PSA,Production Start Authorization,Autorização de Início de Produção,,nao,alta,,processos-qualidade
PSC,Passenger Seat Command,Comando do Banco do Passageiro,componentes,sim,alta,,
PSHS,Passenger Seat Heater System,Sistema de Aquecimento do Banco do Passageiro,componentes,sim,alta,,
PSP,Product Development Process,Processo de Desenvolvimento de Produto (antigo processo de desenvolvimento de veículos do Grupo Fiat),,nao,alta,,processos-qualidade
PSR,Part Spec System (Requirement),Sistema de Especificação de Peças (Requisito),,nao,media,,normas-especificacoes
PTL,Packaging Team Leader,Líder do Time de Packaging,,nao,alta,,organizacao-gestao
PUP,Part Usage Projection,Projeção de Uso de Peça,,nao,media,,processos-qualidade
PV,Product Validation,Validação de Produto,,nao,media,Múltiplos significados (Production Validation Tests).,processos-qualidade
PVE,Pedido de Veículos Especiais,Pedido de Veículos Especiais,,nao,media,Múltiplos significados (Plant Vehicle Engineering/Engineer).,comercial-mercado
PVR,Process Variance Request,Solicitação de Variação de Processo,,nao,alta,,processos-qualidade
PWB,Plywood Buck,Buck/mock-up em compensado (modelo estrutural em madeira),,nao,media,,processos-qualidade
PWM,Pulse Width Modulated or Modulation,Modulação por Largura de Pulso (PWM),tecnologia,sim,alta,,
PWT,PowerTrain,Trem de Força (Powertrain),motorizacao,sim,alta,,
Q.M.,Quality Manager,Gerente de Qualidade,,nao,alta,,organizacao-gestao
Q.T.,Quality Tracking,Rastreamento de Qualidade,,nao,alta,,processos-qualidade
Q.V.L.,Quality Vehicle Line,Linha de Qualidade do Veículo,,nao,alta,,processos-qualidade
Q/B,qualificação/benestare,Qualificação/benestare (aprovação),,nao,alta,,processos-qualidade
QAF,Quality Assurance Fixture,Dispositivo de Garantia da Qualidade (gabarito de controle),,nao,alta,,processos-qualidade
QAS,Quality Audit Survey,Levantamento de Auditoria de Qualidade,,nao,alta,,processos-qualidade
QCL,Quality Car Line,Linha de Qualidade do Carro,,nao,alta,,processos-qualidade
QFS,Quality Feedback System,Sistema de Feedback de Qualidade,,nao,alta,,ti-sistemas
QM,Quality Manager,Gerente de Qualidade,,nao,alta,,organizacao-gestao
QMM,Model Quality Manager,Gerente de Qualidade do Modelo,,nao,alta,,organizacao-gestao
QP (detector),Quasi-peak detector according to CISPR 25,Detector de quase-pico (QP) conforme CISPR 25 (EMC),,nao,alta,,processos-qualidade
QRA,Quality Risk Assessment,Avaliação de Risco de Qualidade,,nao,alta,,processos-qualidade
Q-Team,Quality Team,Time de Qualidade,,nao,alta,,organizacao-gestao
Qualistica,avaliação de cores e texturas,Avaliação de cores e texturas (qualística),,nao,alta,,processos-qualidade
Quality profile,perfil de qualidade,Perfil de qualidade,,nao,alta,,processos-qualidade
QVL,Quality Vehicle Line,Linha de Qualidade do Veículo,,nao,alta,,processos-qualidade
R,Responsible: the one who materially performs an activity through an operational liability. For each activity / process only one responsible must be identified. Responsibility can be shared.,Responsável — aquele que executa materialmente uma atividade; para cada atividade/processo apenas um responsável deve ser identificado; a responsabilidade pode ser compartilhada (papel RASI/RACI),,nao,alta,,processos-qualidade
R&D,Research and Development,Pesquisa e Desenvolvimento (P&D),,nao,alta,,organizacao-gestao
RAC,Roof Area Commands,Comandos da Área do Teto,componentes,sim,alta,,
RAHM,Right Auto Headlamp Module,Módulo do Farol Automático Direito,componentes,sim,alta,,
RAM,Random Access Memory,Memória de Acesso Aleatório (RAM),componentes,sim,media,,
RAR,Review Analysis Request,Solicitação de Análise de Revisão,,nao,media,Múltiplos significados (Requirement Analysis Report).,processos-qualidade
RASI,"The RASI Matrix is a management tool used to define the roles and responsibilities of a project or a business. ""RASI"" is an acronym formed by the words ""Responsible"", ""Approves"", ""Supports"", ""informed"" each of these roles will be assigned to the different actors involved in the project/process.","Matriz RASI — ferramenta de gestão para definir papéis e responsabilidades de um projeto/negócio; acrônimo de Responsible, Approves, Supports, Informed",,nao,alta,,processos-qualidade
RASIC,Mesma coisa que RASI,O mesmo que RASI (com papel adicional «Consulted»),,nao,alta,,processos-qualidade
RCLU,Rear Ceiling Light Unit,Unidade de Luz de Teto Traseira,componentes,sim,alta,,
RCS,Radar Cross Section,Seção Reta de Radar (RCS),tecnologia,sim,alta,,
RDA,Solicitação de Compra,Requisição/Solicitação de Compra,,nao,alta,,comercial-mercado
RE,Resident Engineer,Engenheiro Residente,,nao,alta,,organizacao-gestao
Release,liberação,Liberação (release),,nao,alta,,glossario-generico
Reliability,Confiabilidade,Confiabilidade,,nao,alta,,processos-qualidade
Req.,Requirement,Requisito,,nao,alta,,glossario-generico
RF,Radio Frequency,Radiofrequência (RF),tecnologia,sim,alta,,
RFI,Request for information,Solicitação de Informação (RFI),,nao,alta,,processos-qualidade
RFSDH,Right Front Smart Door Handle,Maçaneta Inteligente Dianteira Direita,componentes,sim,alta,,
RH,Room Humidity,Umidade Ambiente (RH),,nao,media,Parâmetro de ensaio (Room Humidity).,normas-especificacoes
RHDU,Right Headlamp Discharge Unit,Unidade de Descarga do Farol Direito (xenônio),componentes,sim,alta,,
Ricerca Difetti,analise para procurar defeitos,Análise para procurar defeitos (busca de defeitos),,nao,alta,Termo em italiano.,processos-qualidade
RIP,Product Industrialization Responsible,Responsável pela Industrialização do Produto,,nao,alta,,organizacao-gestao
RLDC,Rear Left Door Command,Comando da Porta Traseira Esquerda,componentes,sim,alta,,
RMF,Richiesta Modiffica Fabbisogno (Prototype BOM Change Request),Solicitação de Alteração de Necessidade (mudança na BOM de protótipo),,nao,alta,Termo em italiano.,processos-qualidade
ROM,Read-Only Memory,Memória Somente de Leitura (ROM),componentes,sim,media,,
ROTW,Rest of the World,Resto do Mundo (demais regiões),,nao,alta,,geografia
RRCLU,Rear Right Ceiling Light Unit,Unidade de Luz de Teto Traseira Direita,componentes,sim,alta,,
RRDC,Rear Left Door Command,Comando da Porta Traseira Direita,componentes,sim,media,Fonte grafa «Rear Left»; provável erro (RR = right).,
RRM,Radio Receiver Module = B1 with CAN,Módulo Receptor de Rádio (B1 com CAN),componentes,sim,alta,,
RRU,Radio Receiver Unit = B1 witout CAN,Unidade Receptora de Rádio (B1 sem CAN),componentes,sim,alta,,
RT,Room Temperature conditions (see Table 7),Condições de Temperatura Ambiente (ver Tabela 7),,nao,media,Parâmetro de ensaio (Room Temperature).,normas-especificacoes
RTM,Real-time Manufacturing,Manufatura em Tempo Real,,nao,media,,processos-qualidade
RTM-PBOM,Production Bill of Material,Lista de Materiais de Produção (PBOM),,nao,alta,,ti-sistemas
RVC,Rear View Camera,Câmera de Ré,componentes,sim,alta,,
S,"Supports: the person consulted before performing the task or before taking executive decisions. Is the one whose knowledge is required, typically a subject matter expert and with whom there is a two-way communication.","Suporte — pessoa consultada antes de executar a tarefa ou tomar decisões; aquele cujo conhecimento é necessário (especialista), com comunicação bidirecional (papel RASI)",,nao,alta,,processos-qualidade
S&C,System and Component,Sistema e Componente,,nao,alta,,glossario-generico
S.I.T.R.A.,Integrated Trouble Tracing System,Sistema Integrado de Rastreamento de Anomalias,,nao,alta,,ti-sistemas
S.Q.,Supplier Quality,Qualidade de Fornecedor,,nao,alta,,processos-qualidade
S.Q.E.,Supplier Quality Engineer,Engenheiro de Qualidade de Fornecedor,,nao,alta,,organizacao-gestao
SAD,Software Architecture Document,Documento de Arquitetura de Software,,nao,alta,,normas-especificacoes
SAP MRP,Material Requirement Planning,Planejamento de Necessidades de Material (SAP MRP),,nao,alta,,ti-sistemas
SAS,Speed Assist Systems,Sistemas de Assistência de Velocidade,tecnologia,sim,media,Múltiplos significados (tb. proposta comercial do fornecedor).,
SAT,Solicitação de Alteração Técnica (Technical Change Request),Solicitação de Alteração Técnica (Technical Change Request),,nao,alta,,processos-qualidade
SB,System Bench,Bancada de Sistema (bancada de teste),,nao,media,,processos-qualidade
SBMT,Staco Bateria Mínima Tensione,Desconexão de Bateria por Tensão Mínima (proteção),componentes,sim,media,Termo em italiano (Stacco Batteria Minima Tensione).,
SBOM,Service Bill of Material,Lista de Materiais de Serviço/Pós-venda,,nao,alta,,ti-sistemas
SCD,Solicitação de CoDesign,Solicitação de Co-Design,,nao,alta,,processos-qualidade
Schede Prodotto,ficha de produto,Ficha de produto,,nao,alta,Termo em italiano.,comercial-mercado
SCIE,System Cost Innovation Engineer,Engenheiro de Inovação de Custo de Sistema,,nao,alta,,organizacao-gestao
SCM,Scatolla Cablata Motore,Caixa Cabeada do Motor (chicote/caixa elétrica do motor),componentes,sim,media,Termo em italiano (Scatola Cablata Motore).,
SCRS,Supplier Claims Request System,Sistema de Solicitação de Reclamações a Fornecedores,,nao,alta,,ti-sistemas
Scrum,Agile project management methodology,Metodologia ágil de gestão de projetos (Scrum),,nao,alta,,processos-qualidade
SCU,Sensor and Control Unit,Unidade de Sensor e Controle,componentes,sim,alta,,
Scudato,chassi,Chassi (estrutura da carroceria/underbody),plataformas,sim,media,Termo em italiano (Scudato).,
SDAS,Safety & Driver Assistance Systems,Sistemas de Segurança e Assistência ao Motorista (ADAS),tecnologia,sim,alta,,
SDF,específica de diagnóstico,Específica/arquivo de diagnóstico,,nao,baixa,Termo obscuro; expansão incerta.,ti-sistemas
SEA,Supplier Eligibility Assessment (formerly PSA),Avaliação de Elegibilidade de Fornecedor (antiga PSA),,nao,alta,,processos-qualidade
SED,System Electrical Diagram,Diagrama Elétrico do Sistema,,nao,alta,,normas-especificacoes
See-through,modelo de estilo semitransparente para uma parcial visualização do interno do carro,Modelo de estilo semitransparente para visualização parcial do interior do carro,,nao,alta,,glossario-generico
SEPG,System Engineering Process Group,Grupo de Processos de Engenharia de Sistemas,,nao,alta,,organizacao-gestao
SFS,Standard Functional Structure,Estrutura Funcional Padrão,,nao,media,,normas-especificacoes
SGU,“Sistema de Gestão Unificada” – It is the set of standards that drive the FCA LATAM manufactory.,Sistema de Gestão Unificada — conjunto de padrões que orientam a manufatura da FCA LATAM,,nao,alta,,processos-qualidade
SGW,Sistema de proteção de dados da CAN (Cyber Security),Gateway de Segurança (Secure Gateway) — proteção de dados da rede CAN (cibersegurança),componentes,sim,media,Também descreve função de cibersegurança.,
SHALL,"This word, or the terms “REQUIRED” or “MUST”, mean that the definition is an absolute requirement of the specification.","SHALL — esta palavra, ou os termos «REQUIRED»/«MUST», significam que a definição é um requisito absoluto da especificação (RFC 2119)",,nao,alta,,normas-especificacoes
SHALL NOT,"This phrase, or the phrase “MUST NOT”, means that the definition is an absolute prohibition of the specification.","SHALL NOT — esta expressão, ou «MUST NOT», significa que a definição é uma proibição absoluta da especificação (RFC 2119)",,nao,alta,,normas-especificacoes
SHOULD,"This word, or the adjective “RECOMMENDED”, mean that there may exist valid reasons in particular circumstances to ignore a particular item, but the full implications must be understood and carefully weighed before choosing a different course.","SHOULD — esta palavra, ou o adjetivo «RECOMMENDED», significa que podem existir razões válidas para ignorar um item, mas as implicações completas devem ser ponderadas (RFC 2119)",,nao,alta,,normas-especificacoes
SHOULD NOT,"This phrase, or the phrase “NOT RECOMMENDED” mean that there may exist valid reasons in particular circumstances when the particular behavior is acceptable or even useful, but the full implications should be understood and the case carefully weighed before implementing any behavior described with this label.","SHOULD NOT — esta expressão, ou «NOT RECOMMENDED», significa que podem existir razões válidas para o comportamento, mas as implicações completas devem ser ponderadas (RFC 2119)",,nao,alta,,normas-especificacoes
SiGe,Silicon-Germanium,"Silício-Germânio (SiGe, semicondutor)",componentes,sim,media,,
SIL,Software in (the) loop,"Software na Malha (Software-in-the-Loop, simulação)",,nao,media,,processos-qualidade
SIMP,Product Change Information System,Sistema de Informação de Mudança de Produto,,nao,alta,,ti-sistemas
SINCOM,"código de identificação dos modelos produzidos (tipo, versões, acessórios, etc)","Código de identificação dos modelos produzidos (tipo, versões, acessórios)",,nao,alta,,ti-sistemas
SIR,System Integration Responsible,Responsável pela Integração de Sistema,,nao,alta,,organizacao-gestao
SITRA (Sistema Integrato tracciamento anomalie),Sistema Integrado de Gestão das Anomalias,Sistema Integrado de Gestão das Anomalias,,nao,alta,Termo em italiano.,ti-sistemas
Sk 0 (Scheda 0),documento integrantes da Iniziativa,Documento integrante da Iniciativa (Ficha 0),,nao,media,Termo em italiano.,processos-qualidade
SKF,Scheda Fabbisogno (Solicitação de Peça Avulca),Ficha de Necessidade (Solicitação de Peça Avulsa),,nao,alta,Termo em italiano.,processos-qualidade
SL,Standards List,Lista de Normas/Padrões,,nao,alta,,normas-especificacoes
SLA,Service Level Agreement,Acordo de Nível de Serviço (SLA),,nao,alta,,processos-qualidade
Sleep Mode,The designed full power down mode of an electronic component where it maintains a minimum current draw but is available to be powered up by a signal input,"Modo de baixo consumo total projetado de um componente eletrônico, no qual mantém consumo mínimo de corrente mas pode ser reativado por um sinal de entrada",tecnologia,sim,alta,,
SMI,Supplier Manufacturing Issue -> There was a defect in the part that the supplier is responsible for,Problema de Manufatura do Fornecedor — havia um defeito na peça de responsabilidade do fornecedor,,nao,alta,,processos-qualidade
SMV,State Machine Variables,Variáveis de Máquina de Estados,tecnologia,sim,alta,,
Sneak Path,Unwanted hidden current path,Caminho de corrente indesejado/oculto (sneak path),tecnologia,sim,alta,,
SNR,"Signal-to-noise ratio. A relação entre o sinal e o ruído é descrita pela nomenclatura SNR – Signal to noise ratio‎, assim como a própria sigla, já se auto justifica. Todo sinal recebido será proveniente de um ruído referenciado, ou seja, onde há sinal, há ruido. A grande questão é qual a diferença de sinal necessária para considerar a minha rede dentro dos padrões adequados.",Relação Sinal-Ruído (SNR) — relação entre o sinal e o ruído recebido; indica a diferença de sinal necessária para manter a rede dentro dos padrões,tecnologia,sim,alta,,
SoC,Substance of Concern,"Substância de Preocupação (SoC, controle de materiais/ambiental)",,nao,media,"Aqui é «Substance of Concern», não «System-on-Chip».",normas-especificacoes
SOP,"Start of Production, início da produção de veículos",Início de Produção (Start of Production),,nao,media,Múltiplos significados (Standard of Procedure).,processos-qualidade
Sourced output line,A DUT output line that has its feed source internally connected to or supplied from a feed line into the DUT,Linha de saída alimentada (do DUT) — linha de saída cuja fonte está internamente conectada ou suprida por uma linha de entrada do DUT (EMC),,nao,media,,processos-qualidade
Sourcing,Conjunto de atividades de Compras para definição e gerenciamento de fornecedores,Conjunto de atividades de Compras para definição e gerenciamento de fornecedores,,nao,alta,,processos-qualidade
SPEC,Technical Specification (Baseline),Especificação Técnica (baseline),,nao,alta,,normas-especificacoes
SPM,Change Proposal Sheet,Ficha de Proposta de Mudança,,nao,media,Múltiplos significados (tb. Self Parking Module = componente).,processos-qualidade
Sprint,Time box of the project,Time box (janela de tempo) do projeto (Scrum),,nao,alta,,processos-qualidade
SQA,Supplier Quality Assurance,Garantia da Qualidade de Fornecedor,,nao,alta,,processos-qualidade
SQE,Supplier Quality Engineer,Engenheiro de Qualidade de Fornecedor,,nao,alta,,organizacao-gestao
SR,System Responsible,Responsável de Sistema,,nao,alta,,organizacao-gestao
SRU,Sun Roof Unit,Unidade de Teto Solar,componentes,sim,alta,,
SSTS (Sub System Technical Specification),especificação técnica do sub-sistema,Especificação Técnica do Subsistema,,nao,alta,,normas-especificacoes
Standard,padrão,Padrão/norma (standard),,nao,alta,,glossario-generico
Standby mode,The designed partial power down mode in which the component maintains necessary functions active according to a programmed schedule eventually leading to full power down in the sleep mode,"Modo de baixo consumo parcial projetado, no qual o componente mantém funções necessárias ativas conforme uma programação, eventualmente entrando em modo sleep",tecnologia,sim,alta,,
Std.,Standard,Padrão/norma (abreviação de standard),,nao,alta,,glossario-generico
Step,etapa,"Etapa; cada um dos passos de desenvolvimento das matemáticas — quanto maior o step, maior a maturidade do desenho (steps 1,2,3,5 = veículo; A,B,C = arquitetura/underbody)",,nao,alta,,processos-qualidade
Stimulus,A change induced in the electrical environment of the DUT by any system perturbation,Estímulo — mudança induzida no ambiente elétrico do DUT por qualquer perturbação do sistema (EMC),,nao,media,,processos-qualidade
STS,System Technical Specification,Especificação Técnica de Sistema,,nao,alta,,normas-especificacoes
STV,Specify the vehicle,Especificar o veículo (definição da configuração do veículo),,nao,media,,processos-qualidade
Supply Voltage,The voltage in the vehicle or as simulated on the bench (test voltage) to power the DUT,Tensão de Alimentação — a tensão no veículo ou simulada na bancada (tensão de teste) para alimentar o DUT,,nao,media,,normas-especificacoes
Supply Voltage Lines,The battery and ignition lines and any DUT inputs or outputs sourced from battery or ignition voltage as configured in a DUT's complete system including circuit protection. This includes lines such as voltage sense and illumination and loads sourced from supply voltage and switched to ground in the DUT. These are lines that connect the vehicle electrical power system through a low impedance path to the DUT,"Linhas de Tensão de Alimentação — linhas de bateria e ignição e entradas/saídas do DUT alimentadas por tensão de bateria ou ignição, conectando o sistema elétrico do veículo ao DUT por caminho de baixa impedância (EMC)",,nao,media,,normas-especificacoes
Suprimir/Eliminar,"Suprimir = Apagar Item do Codep || Eliminar = Tirar alguma aplicação do item, mas mantém o item no Banco de Dados","Suprimir = apagar item do CoDeP; Eliminar = tirar alguma aplicação do item, mantendo-o no banco de dados",,nao,alta,,processos-qualidade
SVN,Subversion – Version Control System,Subversion — sistema de controle de versão (SVN),,nao,alta,,ti-sistemas
SW,Small wave,Software,tecnologia,sim,media,Múltiplos significados (tb. Small wave = onda curta).,
SWC,Software Component,Componente de Software,tecnologia,sim,media,Múltiplos significados (tb. Steering Wheel Command = componente).,
SWCC,Software Component Configuration,Configuração de Componente de Software,tecnologia,sim,media,,
SWS,Steering Wheel Switch Bank,Painel de Interruptores do Volante,componentes,sim,alta,,
SymTA/s,Bus load simulation software,Software de simulação de carga de barramento (SymTA/s),,nao,media,,ti-sistemas
T.L.R.,Top Level Requirements,Requisitos de Alto Nível (Top Level Requirements),,nao,alta,,normas-especificacoes
Target Range Assessed,"validação de um Concept de arquitetura do carro em termos de objetivos dimensionais, ergonômicos, etc","Validação de um conceito de arquitetura do carro em termos de objetivos dimensionais, ergonômicos, etc.",,nao,alta,,processos-qualidade
