sigla,significado_EN,traducao_PT_sugerida,categoria_sugerida,cabe_na_taxonomia,confianca,nota,bucket_sugerido
TBD,To Be Defined,A Definir (To Be Defined),,nao,alta,,glossario-generico
TBM,Telematic Box Module,Módulo da Caixa Telemática,componentes,sim,alta,,
TcAE,Teamcenter Automoive edition,Teamcenter Automotive Edition — repositório de arquivos CAD,,nao,alta,,ti-sistemas
TCM,Transmission Control Module,Módulo de Controle da Transmissão (TCM),componentes,sim,media,Múltiplos significados (tb. Teamcenter Manufacture).,
TCR,Technical Cost Reduction,Redução Técnica de Custo,,nao,alta,,comercial-mercado
TD,Data Transmission,Transmissão de Dados,tecnologia,sim,media,Sigla aparentemente invertida na fonte (Data Transmission).,
TDF,Teste Dinâmico Funcional,Teste Dinâmico Funcional,,nao,alta,,processos-qualidade
Team Center,software de gestão das matemáticas da Engenharia do Produto,Software de gestão das matemáticas da Engenharia do Produto (Teamcenter),,nao,alta,,ti-sistemas
TGSS,Tool Graining Specification Sheet,Ficha de Especificação de Texturização de Ferramental (graining),,nao,media,,normas-especificacoes
TGW (Things Gone Wrong),pesquisa sobre anomalias técnicas relevadas por clientes,Pesquisa sobre anomalias técnicas relatadas por clientes (Things Gone Wrong),,nao,alta,,processos-qualidade
TKO,Tooling Kick-Off (Delibera Attrezzare),Início de Ferramental (Delibera Attrezzare),,nao,alta,,processos-qualidade
TL,Technical Lead,Líder Técnico,,nao,alta,,organizacao-gestao
TLD,Technical Lead (Powertrain),Líder Técnico (Powertrain),,nao,alta,,organizacao-gestao
TLM,Telematic Module (Modulos de telematica geral),Módulo de Telemática (módulos de telemática geral),componentes,sim,alta,,
TLR (Top Level Requirements),requerimento em nível macro,Requisito em nível macro (requisitos de alto nível),,nao,alta,,normas-especificacoes
Tmax,Maximum operating ambient temperature,Temperatura ambiente máxima de operação,,nao,media,Parâmetro de ensaio.,normas-especificacoes
TNF,Trouble Not Found -> Part tested complying to specifications at the supplier when the part was returned,Problema Não Encontrado — peça testada em conformidade com as especificações no fornecedor quando foi devolvida,,nao,alta,,processos-qualidade
TO,Try Out,Try Out (teste inicial de ferramental),,nao,alta,,processos-qualidade
TOC,Teste da ótica do cliente,Teste sob a ótica do cliente,,nao,alta,,processos-qualidade
TP Full,Test Pattern Full,Padrão de Teste Completo (Test Pattern Full),,nao,media,,processos-qualidade
TPM,Tire Pressure Module,Módulo de Pressão dos Pneus (TPM),componentes,sim,media,Múltiplos significados (tb. Testing Plan Manager).,
TPO,Tooling Purchase Order,Ordem de Compra de Ferramental,,nao,alta,,comercial-mercado
TSA,Temporary Substitution Approval,Aprovação de Substituição Temporária,,nao,alta,,processos-qualidade
TSBM,Terrain Selector switchBank Module,Módulo de Interruptores do Seletor de Terreno,componentes,sim,alta,,
TTM,Trailer Tow Module,Módulo de Reboque (engate),componentes,sim,alta,,
UAM,Ultrasonic & Antitilt Module,Módulo Ultrassônico e Anti-inclinação,componentes,sim,alta,,
UAT,User Acceptance Testing (UAT),Teste de Aceitação do Usuário (UAT),,nao,alta,,processos-qualidade
UBI,User Based Insurance,Seguro Baseado no Uso (telemetria),,nao,media,,comercial-mercado
UDA,Uniform Delegation of Authority,Delegação Uniforme de Autoridade,,nao,alta,,organizacao-gestao
UHF,Ultra High Frequency,Frequência Ultra-Alta (UHF),tecnologia,sim,alta,,
UR,Unit Responsible,Responsável de Unidade,,nao,alta,,organizacao-gestao
Usmin,Minimum Operating Voltage,Tensão Mínima de Operação (Usmin),tecnologia,sim,media,,
USP,Unique Selling Proposition. São os conceitos/características que diferenciarão o modelo dos concorrentes;,Proposta Única de Venda — conceitos/características que diferenciam o modelo dos concorrentes,,nao,alta,,comercial-mercado
V&V,Verification and Validation,Verificação e Validação (V&V),,nao,alta,,processos-qualidade
V.I.R.,Vehicle Integration Responsible,Responsável pela Integração do Veículo,,nao,alta,,organizacao-gestao
V2,Product Change,Mudança de Produto (V2),,nao,media,,processos-qualidade
V2C,V2C (Vehicle to Cloud),"Veículo para Nuvem (V2C, conectividade)",tecnologia,sim,alta,,
VAE's,Virtual analysis specialist,Especialista em análise virtual (VAE),,nao,media,,organizacao-gestao
Valysis,software utilizado para cálculo de tolerâncias,Software usado para cálculo de tolerâncias (Valysis),,nao,alta,,ti-sistemas
VC&I,Vehicle Concept & Integration,Conceito e Integração do Veículo,,nao,alta,,organizacao-gestao
VCE,Vehicle Cost Engineer,Engenheiro de Custo do Veículo,,nao,alta,,organizacao-gestao
VCI,Virtual Channel Identifier,Identificador de Canal Virtual (VCI),tecnologia,sim,alta,,
VCM,Vehicle Configuration Manager,Gerenciador de Configuração do Veículo,,nao,alta,,ti-sistemas
VCMS,Vehicle Configuration Management System,Sistema de Gestão de Configuração do Veículo,,nao,alta,,ti-sistemas
VCO,Voltage Controlled Oscillator,Oscilador Controlado por Tensão (VCO),componentes,sim,media,,
VDB,Vehicle database,Banco de Dados do Veículo,,nao,alta,,ti-sistemas
VDS,Vehicle Development Synthesis,Síntese de Desenvolvimento do Veículo,,nao,alta,,processos-qualidade
VF,Vehicle Function – Requirements Document,Função do Veículo — documento de requisitos,,nao,alta,,normas-especificacoes
VHF,Very High Frequency,Frequência Muito Alta (VHF),tecnologia,sim,alta,,
VI&V,Vehicle Integration & Validation,Integração e Validação do Veículo,,nao,alta,,processos-qualidade
VIN,Código do Carro (tipo n/ chassi),"Número de Identificação do Veículo (VIN, chassi)",,nao,alta,,glossario-generico
VIR,Vehicle Integration Responsible,Responsável pela Integração do Veículo,,nao,alta,,organizacao-gestao
VLE,Vehicle Line Executive,Executivo de Linha de Veículo,,nao,alta,,organizacao-gestao
VLO,Vehicle Layout Objetivation,Objetivação do Layout do Veículo,,nao,media,,processos-qualidade
VLO (Verifica lay-out vano motore),verificação lay-out motor,Verificação do layout do vão do motor,,nao,alta,Termo em italiano.,processos-qualidade
VOC,Voice of the Customer,Voz do Cliente (VOC),,nao,alta,,comercial-mercado
VP,Verification of Process Build,Verificação de Construção de Processo,,nao,media,Múltiplos significados (Process Verification).,processos-qualidade
VP BIW,Body in white (apenas de carroceria),"Carroceria em bruto (body in white, apenas carroceria)",,nao,media,,processos-qualidade
VP GA,General Assembly (montagem do carro),Montagem Geral do carro (verificação de processo),,nao,media,,processos-qualidade
VR,Voice Recognition,Reconhecimento de Voz,tecnologia,sim,alta,,
VR&I,Vehicle Research and Innovation,Pesquisa e Inovação de Veículo,,nao,alta,,organizacao-gestao
VRF,Validação de requisitos funcionais,Validação de requisitos funcionais,,nao,alta,,processos-qualidade
VSCS,Vehicle order summary counting system,Sistema de contagem/resumo de pedidos de veículos,,nao,alta,,ti-sistemas
VSRC,Vehicle Safety and Regulatory Compliance,Segurança Veicular e Conformidade Regulatória,,nao,alta,,normas-especificacoes
VSS,Vehicle scheduling system,Sistema de programação/agendamento de veículos,,nao,alta,,ti-sistemas
VSU,Voltage Stabilizer Unit,Unidade Estabilizadora de Tensão,componentes,sim,alta,,
VTM,Vehicle Tracking Module,Módulo de Rastreamento do Veículo,componentes,sim,alta,,
VTS (Vehicle Technical Specification),Especificação Técnica do Veículo,Especificação Técnica do Veículo,,nao,alta,,normas-especificacoes
VVR,Vehicle Validation Responsible,Responsável pela Validação do Veículo,,nao,alta,,organizacao-gestao
WBS,Work Breakdown Structure,Estrutura Analítica do Projeto (WBS),,nao,alta,,processos-qualidade
WCD,Wiper Confort Dome Light.,Luz de cortesia/teto com conforto do limpador (Wiper Comfort Dome Light),componentes,sim,media,Fonte grafa «Confort».,
WCL,Wire and Connector List,Lista de Fios e Conectores,,nao,alta,,normas-especificacoes
WCM,World Class Manufacturing,Manufatura de Classe Mundial (WCM),,nao,alta,,processos-qualidade
WebCN,Web Change Note – is a web enabled Change Notification Management tool,Nota de Mudança Web — ferramenta web de gestão de notificações de mudança,,nao,alta,,ti-sistemas
WH,Wire Harness,Chicote Elétrico (Wire Harness),componentes,sim,alta,,
Workflow,Software for management and development of manual,Fluxo de trabalho; software para gestão e desenvolvimento de manuais,,nao,media,,ti-sistemas
WPC,Worldwide Product Configurator,Configurador de Produto Mundial,,nao,alta,,ti-sistemas
WPI,Work Place Integration,Integração do Posto de Trabalho,,nao,media,,processos-qualidade
WSMD,Window Smart Motor Driver,Motor Inteligente do Vidro (lado motorista),componentes,sim,alta,,
WSMP,Window Smart Motor Passenger,Motor Inteligente do Vidro (lado passageiro),componentes,sim,alta,,
WSMRL,Window Smart Motor Rear Left,Motor Inteligente do Vidro Traseiro Esquerdo,componentes,sim,alta,,
WSMRR,Window Smart Motor Rear Right,Motor Inteligente do Vidro Traseiro Direito,componentes,sim,alta,,
X Stock,Stock includes those cars AT the dealership.,Estoque X — inclui os carros na concessionária,,nao,alta,,comercial-mercado
FTE,Full Time Equivalence,Equivalente de Tempo Integral (FTE),,nao,alta,,rh
